date,route_color,route_grade,route_id,rating,style,wall,offset,comment
2019-02-28,Yellow,V0,32cab75cc453e00b7071e6d008026006,4.0,Red Point,wall-slab,118.8,"Fun/easy climb, not very exciting"
2019-02-28,Blue,V0,dab297a9dc9c45dba60dc8bd773c70e7,5.0,Red Point,wall-mezzanine,114.6,Very fun but a bit tricky. Had someone spot me.
2019-02-14,Blue,V4,c2b2b2197e87ae1d11ad4dedad08fc28,4.0,Red Point,wall-slab,192.9,"Got technique 
help from Nancy- thanks!"
2019-02-07,Lime Green,V0,d507658c7872a92c58965c7603b9e061,4.0,Red Point,wall-mezzanine,39.7,"Fun and easy, we call it Crystal"
